{
  "$schema": "../../docs/schemas/digital-sensor-profile-v1.schema.json",
  "schema_version": 1,
  "profile_version": "1.0.0",
  "id": "reference-bayer-sensor",
  "kind": "digital_sensor",
  "manufacturer": "Universal Imaging Project",
  "model": "Reference Full Frame Bayer Sensor",
  "license": "CC0-1.0",
  "created_at": "2026-08-22T00:00:00Z",
  "provenance": {
    "quality": "synthetic",
    "source_type": "project_generated",
    "source_reference": "reference-sensor-v1",
    "measurement_method": null,
    "measured_by": null
  },
  "references": [],
  "data": {
    "active_width_pixels": 6000,
    "active_height_pixels": 4000,
    "sensor_width_mm": 36.0,
    "sensor_height_mm": 24.0,
    "native_bit_depth": 14,
    "cfa": "bayer_rggb",
    "custom_cfa_pattern": null,
    "black_level": 512,
    "white_level": 16383,
    "base_iso": 400.0,
    "iso": { "min": 100.0, "max": 12800.0 },
    "spectral_sensitivity": [
      { "wavelength_nm": 400, "red": 0.04, "green": 0.12, "blue": 0.72 },
      { "wavelength_nm": 550, "red": 0.28, "green": 0.91, "blue": 0.16 },
      { "wavelength_nm": 700, "red": 0.76, "green": 0.08, "blue": 0.01 }
    ]
  }
}
