{
  "$schema": "../../docs/schemas/output-transform-profile-v1.schema.json",
  "schema_version": 1,
  "profile_version": "1.0.0",
  "id": "org.universal-imaging.aces-rec709-output-transform",
  "kind": "output_transform",
  "manufacturer": "Universal Imaging Project",
  "model": "Synthetic ACEScg to Rec.709 Matrix Output Transform",
  "license": "CC0-1.0",
  "created_at": "2026-08-23T00:00:00Z",
  "provenance": {
    "quality": "synthetic",
    "source_type": "project_generated",
    "source_reference": "synthetic-output-transform-v1",
    "measurement_method": null,
    "measured_by": null
  },
  "references": [
    {
      "profile_id": "org.universal-imaging.reference-rec709-display",
      "expected_kind": "display"
    }
  ],
  "data": {
    "input_color_space": "aces_cg",
    "output_encoding": "rec709",
    "output_transfer_function": "rec709",
    "method": "matrix_tone_curve",
    "transform_id": "synthetic-acescg-d60-to-rec709-d65-v1",
    "peak_luminance_nits": 100.0,
    "tone_mapping": "none",
    "custom_output_profile_id": null
  }
}
